{
  "id": "event-driven-architecture-review",
  "title": "Event-Driven Architecture Review",
  "summary": "Evaluate event-driven systems for contracts, ordering, retries, replay, idempotency, ownership, and failure isolation.",
  "description": "Event-Driven Architecture Review frames Kafka, MSK, SQS, EventBridge, SNS as an engineering decision: current state, tradeoffs, risks, constraints, and validation work needed before commitment.",
  "when_to_use": [
    "Use when a design decision needs clear tradeoffs, constraints, risk analysis, and validation criteria.",
    "Use during architecture reviews, RFC preparation, resilience planning, or modernization discussions."
  ],
  "domain": "architecture",
  "category": "event-driven",
  "tools": [
    "codex",
    "claude-code",
    "kiro",
    "cursor",
    "windsurf",
    "github-copilot",
    "gemini-cli",
    "aider"
  ],
  "cloud": [
    "generic"
  ],
  "services": [
    "Kafka",
    "MSK",
    "SQS",
    "EventBridge",
    "SNS"
  ],
  "difficulty": "advanced",
  "risk_level": "high",
  "execution_mode": "read-only",
  "status": "draft",
  "owner": "community",
  "version": "0.1.0",
  "requires_permissions": [
    "read-only access for the scoped service APIs"
  ],
  "input_variables": [
    {
      "name": "scope",
      "type": "string",
      "required": true,
      "description": "System, account, repository, service, or feature scope to inspect."
    },
    {
      "name": "environment",
      "type": "string",
      "required": false,
      "default": "unknown",
      "description": "Environment such as dev, staging, production, or shared services."
    },
    {
      "name": "lookback_days",
      "type": "number",
      "required": false,
      "default": 30,
      "description": "Lookback window for metrics, logs, incidents, costs, or repository history."
    }
  ],
  "output_contract": {
    "format": "markdown",
    "sections": [
      "architecture_context",
      "current_state",
      "event_contracts_and_boundaries",
      "option_analysis",
      "reliability_and_failure_modes",
      "security_and_operational_risks",
      "decision_recommendation",
      "tradeoffs",
      "validation_plan",
      "open_questions"
    ]
  },
  "expected_output": {
    "style": "architecture decision brief with tradeoffs and validation notes",
    "sections": [
      "Event-Driven Architecture Review summary and decision context",
      "Verified scope covering Kafka, MSK, SQS, EventBridge, SNS",
      "Evidence inventory with commands, files, APIs, logs, metrics, or artifacts used",
      "Findings grouped by severity with impact and confidence",
      "Recommended actions with owner, priority, effort, expected impact, and validation steps",
      "Assumptions, failed checks, missing permissions, and known limitations"
    ],
    "quality_checks": [
      "Confirm every material claim is backed by cited evidence or marked as an assumption.",
      "Verify counts, percentages, severity labels, and recommendations before presenting the result.",
      "Ensure the final answer includes every required output contract section.",
      "Confirm no destructive or production-impacting action is executed without explicit approval."
    ]
  },
  "evidence_policy": {
    "must_verify_with_api": true,
    "must_paginate": true,
    "no_inference_from_names": true,
    "state_limitations": true,
    "include_api_failures": true,
    "cite_files_or_commands": true
  },
  "safety_rules": [
    "Operate read-only unless the user explicitly approves a change.",
    "Do not delete, mutate, deploy, rotate, revoke, or reconfigure production resources.",
    "Do not invent evidence. Clearly mark unknowns and unavailable APIs.",
    "Ask for explicit confirmation before recommending execution of destructive or high-risk actions.",
    "Separate verified findings from hypotheses and recommendations."
  ],
  "prompt": "<role>\nYou are a senior architecture engineer executing a PlaybookOps workflow for Event-Driven Architecture Review.\n</role>\n\n<context>\nEvent-Driven Architecture Review frames Kafka, MSK, SQS, EventBridge, SNS as an engineering decision: current state, tradeoffs, risks, constraints, and validation work needed before commitment.\nDomain: architecture\nCategory: event-driven\nServices or systems: Kafka, MSK, SQS, EventBridge, SNS\nExecution mode: read-only\nRisk level: high\n</context>\n\n<task>\nUse the required inputs (scope) to inspect the declared scope and produce a decision-ready result for Event-Driven Architecture Review.\nCollect only verifiable evidence from repository files, commands, APIs, logs, metrics, dashboards, tickets, or user-provided artifacts.\nDo not treat naming conventions, ownership guesses, or environment labels as facts unless they are verified.\n</task>\n\n<scope>\n- Analyze Kafka, MSK, SQS, EventBridge, SNS within the declared scope.\n- Use these minimum permissions or evidence channels when applicable: read-only access for the scoped service APIs.\n- Classify findings by severity, confidence, expected impact, and validation path.\n- Recommend actions without executing mutating changes unless the user explicitly approves them.\n</scope>\n\n<evidence>\n- must_verify_with_api: true\n- must_paginate: true\n- no_inference_from_names: true\n- state_limitations: true\n- include_api_failures: true\n- cite_files_or_commands: true\n</evidence>\n\n<expected_output>\nStyle: architecture decision brief with tradeoffs and validation notes\n- Event-Driven Architecture Review summary and decision context\n- Verified scope covering Kafka, MSK, SQS, EventBridge, SNS\n- Evidence inventory with commands, files, APIs, logs, metrics, or artifacts used\n- Findings grouped by severity with impact and confidence\n- Recommended actions with owner, priority, effort, expected impact, and validation steps\n- Assumptions, failed checks, missing permissions, and known limitations\n</expected_output>\n\n<quality>\n- Confirm every material claim is backed by cited evidence or marked as an assumption.\n- Verify counts, percentages, severity labels, and recommendations before presenting the result.\n- Ensure the final answer includes every required output contract section.\n- Confirm no destructive or production-impacting action is executed without explicit approval.\n</quality>\n\n<safety>\n- Operate read-only unless the user explicitly approves a change.\n- Do not delete, mutate, deploy, rotate, revoke, or reconfigure production resources.\n- Do not invent evidence. Clearly mark unknowns and unavailable APIs.\n- Ask for explicit confirmation before recommending execution of destructive or high-risk actions.\n- Separate verified findings from hypotheses and recommendations.\n</safety>\n\n<output_contract>\nReturn Markdown with these required sections:\n- architecture_context\n- current_state\n- event_contracts_and_boundaries\n- option_analysis\n- reliability_and_failure_modes\n- security_and_operational_risks\n- decision_recommendation\n- tradeoffs\n- validation_plan\n- open_questions\n</output_contract>",
  "adapters": {
    "codex": {
      "format": "task-prompt",
      "notes": "Use inside AGENTS.md or as a direct Codex task with repository context."
    },
    "claude_code": {
      "format": "CLAUDE.md compatible task",
      "notes": "Use with repository-level CLAUDE.md instructions."
    },
    "kiro": {
      "format": "steering/spec/task",
      "notes": "Export as steering files or spec documents for Kiro-compatible workflows."
    },
    "cursor": {
      "format": "workspace-rule-or-task",
      "notes": "Use as a Cursor workspace rule or task prompt."
    },
    "windsurf": {
      "format": "workspace-rule-or-task",
      "notes": "Use as a Windsurf rule or task prompt."
    },
    "github_copilot": {
      "format": "copilot-instructions",
      "notes": "Use as.github/copilot-instructions.md guidance."
    }
  },
  "evaluation": {
    "maturity_level": "L3",
    "scorecard": {
      "clarity": 4,
      "evidence": 4,
      "safety": 5,
      "output_contract": 5,
      "portability": 4,
      "reusability": 4,
      "community_value": 4,
      "maintainability": 4
    }
  },
  "tags": [
    "architecture",
    "events",
    "kafka",
    "eventbridge"
  ],
  "changelog": [
    {
      "version": "0.1.0",
      "date": "2026-05-15",
      "changes": [
        "Initial library version."
      ]
    }
  ]
}
